"id","title","done","due_date"
"365","ex hic consequuntur earum omnis alias ut occaecati culpa","0","1582620058"
"366","omnis laboriosam molestias animi sunt dolore","0","1582620058"
"367","natus corrupti maxime laudantium et voluptatem laboriosam odit","0","1582620058"
"368","reprehenderit quos aut aut consequatur est sed","0","1582620058"
"369","fugiat perferendis sed aut quidem","0","1582620058"
"370","quos quo possimus suscipit minima ut","0","1582620058"
"371","et quis minus quo a asperiores molestiae","0","1582620058"
"372","recusandae quia qui sunt libero","0","1582620058"
"373","ea odio perferendis officiis","0","1582620058"
"374","quisquam aliquam quia doloribus aut","0","1582620058"
"375","fugiat aut voluptatibus corrupti deleniti velit iste odio","0","1582620058"
"376","et provident amet rerum consectetur et voluptatum","0","1582620058"
"377","harum ad aperiam quis","0","1582620058"
"378","similique aut quo","0","1582620058"